,sent,CODA,prep
987,هل هو قريب كفاية للمشي,هل هو قريب كفاية للمشي,هل هو قريب كفاية للمشي
988,داير شوية كريم يد,داير شوية كريم يد,داير شوية كريم يد
989,ممكن تمرر لي الملح,ممكن تمرر لي الملح,ممكن تمرر لي الملح
990,داير امشي لي وول استريت كيف اصل هناك,داير امشي لي وول استريت كيف اصل هناك,داير امشي لي وول استريت كيف اصل هناك
991,ممكن تصلح دا,ممكن تصلح ده,ممكن تصلح ده
992,مساء الخير  اهلا,مساء الخير  اهلا,مسا الخير اهلا
993,ما قادر القى عفشك,ما قادر القى عفشك,ما قادر القى عفشك
994,امشي دغري من فضلك,امشي دغري من فضلك,امشي دغري من فضلك
995,هل الموية هنا صالحة للشرب,هل الموية هنا صالحة للشرب,هل الموية هنا صالحة للشرب
996,اااه ياللا دولارين فقط,اااه ياللا دولارين فقط,اااه ياللا دولارين فقط
997,طيب خلينا نمشي ممكن اساعدك في واجبك المنزلي بعد ناخد شوية بيتزا,طيب خلينا نمشي ممكن اساعدك في واجبك المنزلي بعد ناخد شوية بيتزا,طيب خلينا نمشي ممكن اساعدك في واجبك المنزلي بعد ناخد شوية بيتزا
998,نعم مستر تاناكا في رسالتين ليك,نعم مستر تاناكا في رسالتين ليك,نعم مستر تاناكا في رسالتين ليك
999,ما بناسبني,ما بناسبني,ما بناسبني
1000,بكرة يوم تاني,بكرة يوم تاني,بكرة يوم تاني
1001,امكن اقدر اساعدك هل انت محتاج لي فيتامين سي,امكن اقدر اساعدك هل انت محتاج لي فيتامين سي,امكن اقدر اساعدك هل انت محتاج لي فيتامين سي
1002,محفظتي اتنشلت في القطر,محفظتي اتنشلت في القطر,محفظتي اتنشلت في القطر
1003,هو بعيد جدا احسن تاخد تكسي,هو بعيد جدا احسن تاخد تكسي,هو بعيد جدا احسن تاخد تكسي
1004,داير مقعد ممر من فضلك,داير مقعد ممر من فضلك,داير مقعد ممر من فضلك
1005,ممكن اقاطع,ممكن اقاطع,ممكن اقاطع
1006,وريني واحد اوسع,وريني واحد اوسع,وريني واحد اوسع
1007,اعذرني ممكن تبدل المقاعد معاي,اعذرني ممكن تبدل المقاعد معاي,اعذرني ممكن تبدل المقاعد معاي
1008,نعم طبعا,نعم طبعا,نعم طبعا
1009,امشي للكورنة و لف شمال مع الإشارة,امشي للكورنة و لف شمال مع الإشارة,امشي للكورنة و لف شمال مع الإشارة
1010,هل بتحب دحروجات صغيرة ولا واحدات اكبر,هل بتحب دحروجات صغيرة ولا واحدات اكبر,هل بتحب دحروجات صغيرة ولا واحدات اكبر
1011,داير اخت حاجاتي القيمة في خزنة الفندق,داير اخت حاجاتي القيمة في خزنة الفندق,داير اخت حاجاتي القيمة في خزنة الفندق
1012,عندك غرفة متاحة لي الليلة,عندك غرفة متاحة لي الليلة,عندك غرفة متاحة لي الليلة
1013,نعم بس اتأكد ان عندك تزكرتك معاك,نعم بس اتأكد ان عندك تزكرتك معاك,نعم بس اتأكد ان عندك تزكرتك معاك
1014,ناس جداد اتعينوا في ابريل,ناس جداد اتعينوا في ابريل,ناس جداد اتعينوا في ابريل
1015,اتمنى ذلك,اتمنى ذلك,اتمنى ذلك
1016,اتنين سكوتش و موية من فضلك,اثنين سكوتش و موية من فضلك,اتنين سكوتش و موية من فضلك
1017,اللاعب منو,اللاعب منو,اللاعب منو
1018,ممكن تتصل على اذا لقيت شنطي,ممكن تتصل علي اذا لقيت شنطي,ممكن تتصل على اذا لقيت شنطي
1019,للشمال من فضلك,للشمال من فضلك,للشمال من فضلك
1020,لا داير تقيده,لا داير تقيده,لا داير تقيده
1021,السن القدام دي بتوجع,السن القدام دي بتوجع,السن القدام دي بتوجع
1022,اجد لعبة كمبيوتر لي ولد عمره خمستاشر سنة شنو,اجد لعبة كمبيوتر لي ولد عمره خمستعشر سنة شنو,اجد لعبة كمبيوتر لي ولد عمره خمستاشر سنة شنو
1023,هل هناك كافيتريا ارخص قريبة من هنا,هل هناك كافيتريا ارخص قريبة من هنا,هل هناك كافيتريا ارخص قريبة من هنا
1024,لا لكن شكرا انا حاسي احسن,لا لكن شكرا انا حاسي احسن,لا لكن شكرا انا حاسي احسن
1025,هل عندك اي عيش,هل عندك اي عيش,هل عندك اي عيش
1026,مستواك في الكمان كيف,مستواك في الكمان كيف,مستواك في الكمان كيف
1027,صحبي اتزلق و وقع في الحمام,صحبي اتزلق و وقع في الحمام,صحبي اتزلق و وقع في الحمام
1028,ممكن اخد طفاية,ممكن اخد طفاية,ممكن اخد طفاية
1029,المسيحية كانت محظورة و البلد كانت مقفولة من باقي العالم,المسيحية كانت محظورة و البلد كانت مقفولة من باقي العالم,المسيحية كانت محظورة و البلد كانت مقفولة من باقي العالم
1030,داير كم انت,داير كم انت,داير كم انت
1031,كوكتيل جمبري ليها و نفس الشي لي انا,كوكتيل جمبري ليها و نفس الشي لي انا,كوكتيل جمبري ليها و نفس الشي لي انا
1032,ممكن اخليك توقع هنا و من فضلك بداية هنا,ممكن اخليك توقع هنا و من فضلك بداية هنا,ممكن اخليك توقع هنا و من فضلك بداية هنا
1033,شخيرك مزعج,شخيرك مزعج,شخيرك مزعج
1034,ما بحب اللون دا كله كله ممكن ارجع دا,ما بحب اللون ده كله كله ممكن ارجع ده,ما بحب اللون ده كله كله ممكن ارجع ده
1035,اطلع برة الباب داك هناك و انتظر في الموقف رقم ستة,اطلع برة الباب داك هناك و انتظر في الموقف رقم ستة,اطلع برة الباب داك هناك و انتظر في الموقف رقم ستة
1036,جداد مشوي من فضلك,جداد مشوي من فضلك,جداد مشوي من فضلك
1037,ممكن شوية فلفل,ممكن شوية فلفل,ممكن شوية فلفل
1038,ايوة داير حاجة اقراها,ايوة داير حاجة اقراها,ايوة داير حاجة اقراها
1039,معاك مستر تاكاباشي في غرفة خمسة تسعة وأربعين ممكن ترسل اربعة قارورات من بيرة براوزر من فضلك,معاك مستر تاكاباشي في غرفة خمسة تسعة وأربعين ممكن ترسل اربعة قارورات من بيرة براوزر من فضلك,معاك مستر تاكاباشي في غرفة خمسة تسعة وأربعين ممكن ترسل اربعة قارورات من بيرة براوزر من فضلك
1040,دي سبعين دولار,دي سبعين دولار,دي سبعين دولار
1041,من فضلك اضرب لي فندقي لمن تلقى شنطي,من فضلك اضرب لي فندقي لمن تلقى شنطي,من فضلك اضرب لي فندقي لمن تلقى شنطي
1042,داير مكالمة تصحيني تمنية و نص صباحا من فضلك,داير مكالمة تصحيني ثمانية و نص صباحا من فضلك,داير مكالمة تصحيني تمنية و نص صباحا من فضلك
1043,ايوة لكن دا كتير شديد و انا اساسا ملان,ايوة لكن ده كثير شديد و انا اساسا ملان,ايوة لكن ده كتير شديد و انا اساسا ملان
1044,داير شوية غسول فم,داير شوية غسول فم,داير شوية غسول فم
1045,ما حاسي تمام,ما حاسي تمام,ما حاسي تمام
1046,هل انت بتدي اي تخفيض كبير,هل انت بتدي اي تخفيض كبير,هل انت بتدي اي تخفيض كبير
1047,طوكيو صفر تلاتة اربع تسعات اربعة خمسة ستة سبعة,طوكيو صفر ثلاثة اربع تسعات اربعة خمسة ستة سبعة,طوكيو صفر تلاتة اربع تسعات اربعة خمسة ستة سبعة
1048,ممكن تساعدني القي حديقة الحيوان,ممكن تساعدني القي حديقة الحيوان,ممكن تساعدني القي حديقة الحيوان
1049,جولة البص بتنتهي حوالي كم,جولة البص بتنتهي حوالي كم,جولة البص بتنتهي حوالي كم
1050,هل بتعرف كيف تستخدم تلفون,هل بتعرف كيف تستخدم تلفون,هل بتعرف كيف تستخدم تلفون
1051,اكيد عندنا شوية ماركات كتب امريكية اصلية جميلة,اكيد عندنا شوية ماركات كتب امريكية اصلية جميلة,اكيد عندنا شوية ماركات كتب امريكية اصلية جميلة
1052,مشغل مكالمات يتكلم ياباني من فضلك,مشغل مكالمات يتكلم ياباني من فضلك,مشغل مكالمات يتكلم ياباني من فضلك
1053,نحن مهتمين بالموضة,نحن مهتمين بالموضة,نحن مهتمين بالموضة
1054,ممكن تديني دفرة,ممكن تديني دفرة,ممكن تديني دفرة
1055,هل دا الكلنك اف,هل ده الكلنك اف,هل ده الكلنك اف
1056,اهلا انسة ياماقوشي الطرف التاني في الخط مكالمتك اتقبلت اتفضلي من فضلك,اهلا انسة ياماقوشي الطرف الثاني في الخط مكالمتك اتقبلت اتفضلي من فضلك,اهلا انسة ياماقوشي الطرف التاني في الخط مكالمتك اتقبلت اتفضلي من فضلك
1057,وين ممكن اشتري تزكرة رفع قسيمة,وين ممكن اشتري تزكرة رفع قسيمة,وين ممكن اشتري تزكرة رفع قسيمة
1058,امشي دغري لحوالي خمسة دقائق و لف شمال,امشي دغري لحوالي خمسة دقائق و لف شمال,امشي دغري لحوالي خمسة دقايق و لف شمال
1059,هو الشارع دا تجاه الشاطئ,هو الشارع ده تجاه الشاطئ,هو الشارع ده تجاه الشاطي
1060,الشاي العشبي دا بساعد في تجديد الجسم,الشاي العشبي ده بساعد في تجديد الجسم,الشاي العشبي ده بساعد في تجديد الجسم
1061,دي ما مصنوعة في اليابان ولا لا,دي ما مصنوعة في اليابان ولا لا,دي ما مصنوعة في اليابان ولا لا
1062,كله تمام الشارع دا من فضلك ح اوديك لغرفتك,كله تمام الشارع ده من فضلك حاوديك لي غرفتك,كله تمام الشارع ده من فضلك حاوديك لغرفتك
1063,لازم امشي من الفندق قبل الظهر,لازم امشي من الفندق قبل الظهر,لازم امشي من الفندق قبل الظهر
1064,اتنين هامبرقر و قهوتين من فضلك داير اشيلهم برة,اثنين هامبرقر و قهوتين من فضلك داير اشيلهم برة,اتنين هامبرقر و قهوتين من فضلك داير اشيلهم برة
1065,ممكن اشيل الشنط دي,ممكن اشيل الشنط دي,ممكن اشيل الشنط دي
1066,طلبت لحم ما سمك ممكن تغير دا,طلبت لحم ما سمك ممكن تغير ده,طلبت لحم ما سمك ممكن تغير ده
1067,طفلي اتحذر تماما,طفلي اتحذر تماما,طفلي اتحذر تماما
1068,انا مريض في المعدة,انا مريض في المعدة,انا مريض في المعدة
1069,الجاكيت دا ما مقاسي,الجاكيت ده ما مقاسي,الجاكيت ده ما مقاسي
1070,داير اقابل مستر ويليام,داير اقابل مستر ويليام,داير اقابل مستر ويليام
1071,السن ملكلكة,السن ملكلكة,السن ملكلكة
1072,ممكن ارجع قروشي لمن ارجع لليابان,ممكن ارجع قروشي لمن ارجع لليابان,ممكن ارجع قروشي لمن ارجع لليابان
1073,الصحن دا مصنوع من شنو,الصحن ده مصنوع من شنو,الصحن ده مصنوع من شنو
1074,ده مصنوع في ياتو بلد,ده مصنوع في ياتو بلد,ده مصنوع في ياتو بلد
1075,ممكن تعمله في عشرة دقائق,ممكن تعمله في عشرة دقائق,ممكن تعمله في عشرة دقايق
1076,انا ما كويس في الإنجليزي هل في اي زول هنا بتكلم ياباني,انا ما كويس في الإنجليزي هل في اي زول هنا بتكلم ياباني,انا ما كويس في الإنجليزي هل في اي زول هنا بتكلم ياباني
1077,وين ممكن القى رمز النفق,وين ممكن القى رمز النفق,وين ممكن القى رمز النفق
1078,ما اظن ان داك لي لأن بشرتي جافة شديد,ما اظن ان داك لي لأن بشرتي جافة شديد,ما اظن ان داك لي لأن بشرتي جافة شديد
1079,ممكن اجد جدول زمني من فضلك,ممكن اجد جدول زمني من فضلك,ممكن اجد جدول زمني من فضلك
1080,تسعة وتسعين دولار للساعة للطفل,تسعة وتسعين دولار للساعة للطفل,تسعة وتسعين دولار للساعة للطفل
1081,انا آسف خلصنا,انا آسف خلصنا,انا آسف خلصنا
1082,لازم يكون هادئ,لازم يكون هادئ,لازم يكون هادي
1083,عندى معداتي الخاصة,عندي معداتي الخاصة,عندى معداتي الخاصة
1084,مفتاح غرفة خمسة صفر تلاتة من فضلك,مفتاح غرفة خمسة صفر ثلاثة من فضلك,مفتاح غرفة خمسة صفر تلاتة من فضلك
1085,ياتو زمن ترمنال مان بكون معروض,ياتو زمن ترمنال مان بكون معروض,ياتو زمن ترمنال مان بكون معروض
1086,عند الساعة سبعة من فضلك,عند الساعة سبعة من فضلك,عند الساعة سبعة من فضلك
1087,شنطتي اتدمرت,شنطتي اتدمرت,شنطتي اتدمرت
1088,سياحة,سياحة,سياحة
1089,انا جيت من اسبانيا,انا جيت من اسبانيا,انا جيت من اسبانيا
1090,في حاجة غلط في مفتاح البطاقة ممكن تديني واحد تاني من فضلك,في حاجة غلط في مفتاح البطاقة ممكن تديني واحد ثاني من فضلك,في حاجة غلط في مفتاح البطاقة ممكن تديني واحد تاني من فضلك
1091,عندي طفح في يديني,عندي طفح في يديني,عندي طفح في يديني
1092,رسل دي جويا لليابان من فضلك,رسل دي جويا لليابان من فضلك,رسل دي جويا لليابان من فضلك
1093,وين اقرب صيدلية,وين اقرب صيدلية,وين اقرب صيدلية
1094,خمرة تانية من فضلك,خمرة ثانية من فضلك,خمرة تانية من فضلك
1095,ناس ودودين جدا,ناس ودودين جدا,ناس ودودين جدا
1096,كم مشروب متضمن في السعر,كم مشروب متضمن في السعر,كم مشروب متضمن في السعر
1097,انت عملتها,انت عملتها,انت عملتها
1098,وين بوابة الدخول للرحلة دي,وين بوابة الدخول للرحلة دي,وين بوابة الدخول للرحلة دي
1099,لو في ممكن تحجز طربيزة جنب الشباك,لو في ممكن تحجز طربيزة جنب الشباك,لو في ممكن تحجز طربيزة جنب الشباك
1100,اعلانات الأربعاء كانت اساسا معمولة,اعلانات الأربعاء كانت اساسا معمولة,اعلانات الأربعا كانت اساسا معمولة
1101,نحن في ارتفاع اتناشر الف قدم,نحن في ارتفاع اتنعشر الف قدم,نحن في ارتفاع اتناشر الف قدم
1102,اولا دايرين نشوف وول استريت,اولا دايرين نشوف وول استريت,اولا دايرين نشوف وول استريت
1103,وين موقف البص لاكسفورد,وين موقف البص لاكسفورد,وين موقف البص لاكسفورد
1104,ممكن نشوف محافظ جلدية,ممكن نشوف محافظ جلدية,ممكن نشوف محافظ جلدية
1105,خلينا نحضر التلفزيون في لعبة بيسبول شغالة,خلينا نحضر التلفزيون في لعبة بيسبول شغالة,خلينا نحضر التلفزيون في لعبة بيسبول شغالة
1106,ممكن تكتب عنوانك هنا,ممكن تكتب عنوانك هنا,ممكن تكتب عنوانك هنا
1107,من فضلك وريني وين اقرب صيدلية,من فضلك وريني وين اقرب صيدلية,من فضلك وريني وين اقرب صيدلية
1108,لي فندقي من فضلك عنوان فندقي هنا,لي فندقي من فضلك عنوان فندقي هنا,لي فندقي من فضلك عنوان فندقي هنا
1109,في كم ولاية غير طوكيو,في كم ولاية غير طوكيو,في كم ولاية غير طوكيو
1110,اقفل الخط و انتظر شوية من فضلك,اقفل الخط و انتظر شوية من فضلك,اقفل الخط و انتظر شوية من فضلك
1111,انت عادة بتعمل شنو في البيت بعد العشاء,انت عادة بتعمل شنو في البيت بعد العشا,انت عادة بتعمل شنو في البيت بعد العشا
1112,بالتأكيد متين داير تلعب قولف,بالتأكيد متين داير تلعب قولف,بالتأكيد متين داير تلعب قولف
1113,داير اتصل بالسفارة اليابانية,داير اتصل بالسفارة اليابانية,داير اتصل بالسفارة اليابانية
1114,زيادة شوية,زيادة شوية,زيادة شوية
1115,من وين بتغادر بصات معالم المدينة,من وين بتغادر بصات معالم المدينة,من وين بتغادر بصات معالم المدينة
1116,كم بتشحن عشان اترسلو لليابان,كم بتشحن عشان اترسلو لليابان,كم بتشحن عشان اترسلو لليابان
1117,ما عندي اندية او جزم,ما عندي اندية او جزم,ما عندي اندية او جزم
1118,هل الين الياباني تمام,هل الين الياباني تمام,هل الين الياباني تمام
1119,هل عندك موستاج,هل عندك موستاج,هل عندك موستاج
1120,مستر كاواي عندنا طربيزة ليك الآن تعال من هنا من فضلك,مستر كاواي عندنا طربيزة ليك الآن تعال من هنا من فضلك,مستر كاواي عندنا طربيزة ليك الآن تعال من هنا من فضلك
1121,مكتب الاستقبال ممكن اساعدك,مكتب الاستقبال ممكن اساعدك,مكتب الاستقبال ممكن اساعدك
1122,ممكن تنزلني في فندق الهلتون من فضلك,ممكن تنزلني في فندق الهلتون من فضلك,ممكن تنزلني في فندق الهلتون من فضلك
1123,هل انت دايما بتشتغل متأخر,هل انت دايما بتشتغل متأخر,هل انت دايما بتشتغل متأخر
1124,طربيزة لغير المدخنين من فضلك,طربيزة لغير المدخنين من فضلك,طربيزة لغير المدخنين من فضلك
1125,ممكن تخليني اعرف قبل ما نصل دورام,ممكن تخليني اعرف قبل ما نصل دورام,ممكن تخليني اعرف قبل ما نصل دورام
1126,دا فريش,دا فريش,ده فريش
1127,ما صاح انت دائما بتعاملني,ما صاح انت دايما بتعاملني,ما صاح انت دايما بتعاملني
1128,ممكن اوريك شوية فساتين,ممكن اوريك شوية فساتين,ممكن اوريك شوية فساتين
1129,اتهجاه من فضلك,اتهجاه من فضلك,اتهجاه من فضلك
1130,انا سكرت,انا سكرت,انا سكرت
1131,خلي بالك لأن الجو متغير شديد في الجبال,خلي بالك لأن الجو متغير شديد في الجبال,خلي بالك لأن الجو متغير شديد في الجبال
1132,شيك سياحي و ين ياباني اوكي,شيك سياحي و ين ياباني اوكي,شيك سياحي و ين ياباني اوكي
1133,آسف انا اتحققت من خدمة الغرف وقسم المفقودات ما موجود عندهم,آسف انا اتحققت من خدمة الغرف وقسم المفقودات ما موجود عندهم,آسف انا اتحققت من خدمة الغرف وقسم المفقودات ما موجود عندهم
1134,حته صعب تلقاها هي في شارع فرعي,حته صعب تلقاها هي في شارع فرعي,حته صعب تلقاها هي في شارع فرعي
1135,ما بعرف شي عنه,ما بعرف شي عنه,ما بعرف شي عنه
1136,ممكن نناقشه في مقهى,ممكن نناقشه في مقهى,ممكن نناقشه في مقهى
1137,فهمت في الحالة ديك انا ما علي دفع سعر التعديلات صاح,فهمت في الحالة ديك انا ما علي دفع سعر التعديلات صاح,فهمت في الحالة ديك انا ما علي دفع سعر التعديلات صاح
1138,موظف المكالمات من فضلك,موظف المكالمات من فضلك,موظف المكالمات من فضلك
1139,ممكن توطي السرج من فضلك,ممكن توطي السرج من فضلك,ممكن توطي السرج من فضلك
1140,هل حتستضيفني عندك الليلة,هل حتستضيفني عندك الليلة,هل حتستضيفني عندك الليلة
1141,دي فاتورتك تلتمية وسبعة وتسعين دولار,دي فاتورتك ثلثمية وسبعة وتسعين دولار,دي فاتورتك تلتمية وسبعة وتسعين دولار
1142,انت محظوظ,انت محظوظ,انت محظوظ
1143,من فضلك خليها طربيزة مع منظر ليلى جيد,من فضلك خليها طربيزة مع منظر ليلي جيد,من فضلك خليها طربيزة مع منظر ليلى جيد
1144,هل دا صنع آلي ول صنع يدوي,هل دا صنع آلي ولا صنع يدوي,هل ده صنع آلي ولا صنع يدوي
1145,كان جميل جدا الاقيك,كان جميل جدا الاقيك,كان جميل جدا الاقيك
1146,ده مشرط,ده مشرط,ده مشرط
1147,تمام اسي خلينا نعاين ليك,تمام اسي خلينا نعاين ليك,تمام اسي خلينا نعاين ليك
1148,الوزن كم,الوزن كم,الوزن كم
1149,هل في كافيتريا صينية حوالي هنا,هل في كافيتريا صينية حوالي هنا,هل في كافيتريا صينية حوالي هنا
1150,رصيف خمسة هناك,رصيف خمسة هناك,رصيف خمسة هناك
1151,كاميرتي ما شغالة ممكن تشوفها,كاميرتي ما شغالة ممكن تشوفها,كاميرتي ما شغالة ممكن تشوفها
1152,اعتقد انه في شوية اخطاء في الفاتورة,اعتقد انه في شوية أخطاء في الفاتورة,اعتقد انه في شوية اخطا في الفاتورة
1153,من فضلك اديني الواحد داك,من فضلك اديني الواحد داك,من فضلك اديني الواحد داك
1154,دي بوابة سبعة,دي بوابة سبعة,دي بوابة سبعة
1155,هل انت اسكتلندي,هل انت اسكتلندي,هل انت اسكتلندي
1156,تلاتة-اتنين-واحد-اتنين انتظر ثانية كله تمام داير ارسل ليك حاجة هنا اعذرني,ثلاثة-اثنين-واحد-اثنين انتظر ثانية كله تمام داير ارسل ليك حاجة هنا اعذرني,تلاتة-اتنين-واحد-اتنين انتظر ثانية كله تمام داير ارسل ليك حاجة هنا اعذرني
1157,مئة و خمسة وتلاتين ين للدولار,مية و خمسة وثلاثين ين للدولار,مية و خمسة وتلاتين ين للدولار
