,sent,CODA,prep
0,هو هناك بالظبط قدام مكتب معلومات السياح,هو هناك بالظبط قدام مكتب معلومات السياح,هو هناك بالظبط قدام مكتب معلومات السياح
1,ما حصل سمعت بالعنوان دا هنا,ما حصل سمعت بالعنوان ده هنا,ما حصل سمعت بالعنوان ده هنا
2,امشي دغري لغاية تشوف صيدلية,امشي دغري لغاية تشوف صيدلية,امشي دغري لغاية تشوف صيدلية
3,بي كم الفطور,بي كم الفطور,بي كم الفطور
4,كيف ممكن اساعدك,كيف ممكن اساعدك,كيف ممكن اساعدك
5,امشي شمال عند الكورنة التالتة,امشي شمال عند الكورنة الثالثة,امشي شمال عند الكورنة التالتة
6,داير كريمة و سكر في قهوتك,داير كريمة و سكر في قهوتك,داير كريمة و سكر في قهوتك
7,ممكن تصرف شيكي البي متين دولار,ممكن تصرف شيكي البي متين دولار,ممكن تصرف شيكي البي متين دولار
8,اذا مفروض يظهر من فضلك اتصل على,اذا مفروض يظهر من فضلك اتصل علي,اذا مفروض يظهر من فضلك اتصل على
9,وين المقهى,وين المقهى,وين المقهى
10,داير جاكيت اطفال,داير جاكيت اطفال,داير جاكيت اطفال
11,اوكي هو يكلف خمسة وتمنين سنت للبريد العادي و تلاتة دولارات بالظبط زيادة للتسليم الخاص,اوكي هو يكلف خمسة وثمانين سنت للبريد العادي و ثلاثة دولارات بالظبط زيادة للتسليم الخاص,اوكي هو يكلف خمسة وتمنين سنت للبريد العادي و تلاتة دولارات بالظبط زيادة للتسليم الخاص
12,هل عندك جزمة رسمية عريضة في اصابع القدم,هل عندك جزمة رسمية عريضة في اصابع القدم,هل عندك جزمة رسمية عريضة في اصابع القدم
13,لا ممكن اقترح غرفة مزدوجة يستعملها زول واحد عندنا واحدة,لا ممكن اقترح غرفة مزدوجة يستعملها زول واحد عندنا واحدة,لا ممكن اقترح غرفة مزدوجة يستعملها زول واحد عندنا واحدة
14,داير تجعيدة ضيقة من فضلك,داير تجعيدة ضيقة من فضلك,داير تجعيدة ضيقة من فضلك
15,دايرة بيرة,دايرة بيرة,دايرة بيرة
16,صباح الخير كيفك,صباح الخير كيفك,صباح الخير كيفك
17,ياتو نوع من الصوص,ياتو نوع من الصوص,ياتو نوع من الصوص
18,دا بارد شوية ممكن تسخنه,ده بارد شوية ممكن تسخنه,ده بارد شوية ممكن تسخنه
19,معليش المكان دا محجوز,معليش المكان ده محجوز,معليش المكان ده محجوز
20,انا تمام بس ممكن تتصل ل صحبى,انا تمام بس ممكن تتصل لي صحبى,انا تمام بس ممكن تتصل لي صحبى
21,شكرا دا كفاية,شكرا ده كفاية,شكرا ده كفاية
22,منو صحبك المفضل,منو صحبك المفضل,منو صحبك المفضل
23,يوم الصحة والرياضة هو عشرة اكتوبر و هوعطلة قومية مصممة لتحسين صحة الناس,يوم الصحة والرياضة هو عشرة اكتوبر و هوعطلة قومية مصممة لتحسين صحة الناس,يوم الصحة والرياضة هو عشرة اكتوبر و هوعطلة قومية مصممة لتحسين صحة الناس
24,دايرني شوف تحت الكبوت,دايرني شوف تحت الكبوت,دايرني شوف تحت الكبوت
25,هل ممكن تساعدني القى شنطتي,هل ممكن تساعدني القى شنطتي,هل ممكن تساعدني القى شنطتي
26,هل ممكن تعمل ترتيبات مقدما,هل ممكن تعمل ترتيبات مقدما,هل ممكن تعمل ترتيبات مقدما
27,في زول بيساعدني شكرا ليك,في زول بيساعدني شكرا ليك,في زول بيساعدني شكرا ليك
28,لمن تصل هناك اسأل زول تاني من فضلك,لمن تصل هناك اسأل زول تاني من فضلك,لمن تصل هناك اسأل زول تاني من فضلك
29,داير تمديد اربعة وعشرين ساعة من فضلك,داير تمديد اربعة وعشرين ساعة من فضلك,داير تمديد اربعة وعشرين ساعة من فضلك
30,ديل دولارين اخد الباقي,ديل دولارين اخد الباقي,ديل دولارين اخد الباقي
31,هامبرقر واحد و واحد بيرقر بالجبنة من فضلك,هامبرقر واحد و واحد بيرقر بالجبنة من فضلك,هامبرقر واحد و واحد بيرقر بالجبنة من فضلك
32,نحن كلنا دايرين ندفع لي وجباتنا,نحن كلنا دايرين ندفع لي وجباتنا,نحن كلنا دايرين ندفع لي وجباتنا
33,الموقع كان في كرسي في اللوبي,الموقع كان في كرسي في اللوبي,الموقع كان في كرسي في اللوبي
34,من فضلك حول الينات دي لي جنيهات,من فضلك حول الينات دي لي جنيهات,من فضلك حول الينات دي لي جنيهات
35,داير دكشنري مقاس جيب من فضلك,داير دكشنري مقاس جيب من فضلك,داير دكشنري مقاس جيب من فضلك
36,لي نفرين الساعة سبعة الاسم واتانيبل,لي نفرين الساعة سبعة الاسم واتانيبل,لي نفرين الساعة سبعة الاسم واتانيبل
37,ساعتي كانت سيكو ديجيتال,ساعتي كانت سيكو ديجيتال,ساعتي كانت سيكو ديجيتال
38,انت ساكن بي هنا,انت ساكن بي هنا,انت ساكن بي هنا
39,وين دكان الهدايا,وين دكان الهدايا,وين دكان الهدايا
40,انا في الطريق السريع جنب مورو بي,انا في الطريق السريع جنب مورو بي,انا في الطريق السريع جنب مورو بي
41,داير لي ساعة تنبيه من فضلك,داير لي ساعة تنبيه من فضلك,داير لي ساعة تنبيه من فضلك
42,بالمناسبة اسمي هيروشي ايجيما,بالمناسبة اسمي هيروشي ايجيما,بالمناسبة اسمي هيروشي ايجيما
43,القطر دا بقيف في ليك فورست ول لا,القطر دا بقيف في ليك فورست ولا لأ,القطر ده بقيف في ليك فورست ولا لا
44,معظم اليابانيين بياكلوا اخطبوط و حبار,معظم اليابانيين بياكلوا اخطبوط و حبار,معظم اليابانيين بياكلوا اخطبوط و حبار
45,ممكن اخد تذكرتين درجة تانية الي شيكاغو من فضلك,ممكن اخد تذكرتين درجة ثانية لي شيكاغو من فضلك,ممكن اخد تذكرتين درجة تانية الي شيكاغو من فضلك
46,مشيت نيويورك,مشيت نيويورك,مشيت نيويورك
47,رقم الرحلة كم,رقم الرحلة كم,رقم الرحلة كم
48,واحد الى نيويورك من فضلك,واحد لي نيويورك من فضلك,واحد لي نيويورك من فضلك
49,لحوالي ايام قليلة,لحوالي ايام قليلة,لحوالي ايام قليلة
50,التاني على الشمال,الثاني على الشمال,التاني على الشمال
51,الكرت دا تمام,الكرت ده تمام,الكرت ده تمام
52,دا مكتب الاستقبال في عيادة قريبة,ده مكتب الاستقبال في عيادة قريبة,ده مكتب الاستقبال في عيادة قريبة
53,هل عشرة دولارات كفاية للتكسي,هل عشرة دولارات كفاية للتكسي,هل عشرة دولارات كفاية للتكسي
54,دا طعموا غريب,ده طعموا غريب,ده طعموا غريب
55,اي انتظر بجيب ليك واحد,اي انتظر بجيب ليك واحد,اي انتظر بجيب ليك واحد
56,نص قارورة من فضلك,نص قارورة من فضلك,نص قارورة من فضلك
57,ما حقيقة بس حاجة ما غالية,ما حقيقة بس حاجة ما غالية,ما حقيقة بس حاجة ما غالية
58,اربعة ليالي,اربعة ليالي,اربعة ليالي
59,داير بعض الشرابات,داير بعض الشرابات,داير بعض الشرابات
60,ممكن تخليه ارخص عشن في شوية بقع,ممكن تخليه ارخص عشن في شوية بقع,ممكن تخليه ارخص عشن في شوية بقع
61,زول صدمني بعد داك لاحظت انو محفظتي راحت,زول صدمني بعد داك لاحظت انو محفظتي راحت,زول صدمني بعد داك لاحظت انو محفظتي راحت
62,انا ما متأكد اذا ستفت هدوم كافية لي رحلة تلاته اسابيع,انا ما متأكد اذا ستفت هدوم كافية لي رحلة ثلاثة اسابيع,انا ما متأكد اذا ستفت هدوم كافية لي رحلة تلاته اسابيع
63,طيب دايرين نجرب خمرة بيضاء,طيب دايرين نجرب خمرة بيضاء,طيب دايرين نجرب خمرة بيضا
64,اذا في زول سأل عني كلمهم اني في المقهى,اذا في زول سأل عني كلمهم اني في المقهى,اذا في زول سأل عني كلمهم اني في المقهى
65,متأكد انه عندي في الجيب الداخلي بتاع الجاكيت بتاعي,متأكد انو عندي في الجيب الداخلي بتاع الجاكيت بتاعي,متأكد انه عندي في الجيب الداخلي بتاع الجاكيت بتاعي
66,ممكن اعرف الاسم و الرقم بتاع الزول الانت ضارب ليه,ممكن اعرف الاسم و الرقم بتاع الزول الانت ضارب ليه,ممكن اعرف الاسم و الرقم بتاع الزول الانت ضارب ليه
67,ما في حاجة جات طالعة من الآلة,ما في حاجة جات طالعة من الآلة,ما في حاجة جات طالعة من الآلة
68,كان مفترض تاخد الرحلة تمانية اتنين صفر الأقلعت قبل خمستاشر دقيقة كلو تمام ممكن انظم رحلة ثانية,كان مفترض تاخد الرحلة ثمانية اثنين صفر الأقلعت قبل خمستعشر دقيقة كلو تمام ممكن انظم رحلة ثانية,كان مفترض تاخد الرحلة تمانية اتنين صفر الأقلعت قبل خمستاشر دقيقة كلو تمام ممكن انظم رحلة ثانية
69,زول فك حزمتي,زول فك حزمتي,زول فك حزمتي
70,اوه ولا حاجة انت هنا على كل حال,اوه ولا حاجة انت هنا على كل حال,اوه ولا حاجة انت هنا على كل حال
71,الخطوط الجوية اليابانية رحلة رقم واحد اتنين تلاتة,الخطوط الجوية اليابانية رحلة رقم واحد اثنين ثلاثة,الخطوط الجوية اليابانية رحلة رقم واحد اتنين تلاتة
72,محتاج اشتري شامبوه,محتاج اشتري شامبوه,محتاج اشتري شامبوه
73,ممكن تكلمني لم نصل الي مركز مدني,ممكن تكلمني لم نصل لي مركز مدني,ممكن تكلمني لم نصل الي مركز مدني
74,وين اقرب جزار,وين اقرب جزار,وين اقرب جزار
75,دايرين نقعد اربعة ليالي من الأول من اغسطس,دايرين نقعد اربعة ليالي من الأول من اغسطس,دايرين نقعد اربعة ليالي من الأول من اغسطس
76,اسم الزهرة ديك شنو,اسم الزهرة ديك شنو,اسم الزهرة ديك شنو
77,خمستاشر سبتمبر هو يوم احترام للمسنين,خمستعشر سبتمبر هو يوم احترام للمسنين,خمستاشر سبتمبر هو يوم احترام للمسنين
78,هل في اي شي ممكن اخده للطفح دا,هل في اي شي ممكن اخده للطفح ده,هل في اي شي ممكن اخده للطفح ده
79,ممكن تغير صيغة الي القلته هسا,ممكن تغير صيغة الي القلته هسا,ممكن تغير صيغة الي القلته هسا
80,ممكن تتكلم اعلى شوية من فضلك,ممكن تتكلم اعلى شوية من فضلك,ممكن تتكلم اعلى شوية من فضلك
81,وين معلومات الرياضات,وين معلومات الرياضات,وين معلومات الرياضات
82,المقاس دا هنا الواحد المسميه مقاس منتظم بقضّي,المقاس ده هنا الواحد المسميه مقاس منتظم بقضّي,المقاس ده هنا الواحد المسميه مقاس منتظم بقضّي
83,وين مفترض اغير القطرعشن اصل ادينبيره,وين مفترض اغير القطرعشن اصل ادينبيره,وين مفترض اغير القطرعشن اصل ادينبيره
84,داير اخت دا في صندوق ايداع امن,داير اخت ده في صندوق ايداع امن,داير اخت ده في صندوق ايداع امن
85,وين ممكن ابدل قروش,وين ممكن ابدل قروش,وين ممكن ابدل قروش
86,ممكن نخلي حاجاتتا عدا القيمة في البص,ممكن نخلي حاجاتتا عدا القيمة في البص,ممكن نخلي حاجاتتا عدا القيمة في البص
87,محتار الرسوم دي في تلفوني لي شنو,محتار الرسوم دي في تلفوني لي شنو,محتار الرسوم دي في تلفوني لي شنو
88,الآن عرفت الكان غلط شنو,الآن عرفت الكان غلط شنو,الآن عرفت الكان غلط شنو
89,كم اوقية من العطر ممكن اشيل بدون جمارك,كم اوقية من العطر ممكن أشيل بدون جمارك,كم اوقية من العطر ممكن اشيل بدون جمارك
90,بس سياحة,بس سياحة,بس سياحة
91,تمام من فضلك وقعهم دايرو كيف,تمام من فضلك وقعهم دايره كيف,تمام من فضلك وقعهم دايرو كيف
92,هل ما زلت عندك,هل ما زلت عندك,هل ما زلت عندك
93,داير واحد كبير,داير واحد كبير,داير واحد كبير
94,نمت خلال منبه الستة و نص,نمت خلال منبه الستة و نص,نمت خلال منبه الستة و نص
95,انا مصور حر,انا مصور حر,انا مصور حر
96,التجار ممكن يحاولوا دولاراتك لي قطع الكازينو,التجار ممكن يحاولوا دولاراتك لي قطع الكازينو,التجار ممكن يحاولوا دولاراتك لي قطع الكازينو
97,عندنا حوالي تلاتين نوع من صابون الحمام,عندنا حوالي ثلاثين نوع من صابون الحمام,عندنا حوالي تلاتين نوع من صابون الحمام
98,شكرا ليك كم سعر القفازات دي,شكرا ليك كم سعر القفازات دي,شكرا ليك كم سعر القفازات دي
99,داير بعض الحفاظات الممكن التخلص منها,داير بعض الحفاظات الممكن التخلص منها,داير بعض الحفاظات الممكن التخلص منها
100,من وين اصل سمك الفراشات ده,من وين اصل سمك الفراشات ده,من وين اصل سمك الفراشات ده
101,هل في اي ليموزين,هل في اي ليموزين,هل في اي ليموزين
102,ممكن تضربو لي تصحوني خمسة و نص بكرة الصباح,ممكن تضربوا لي تصحوني  خمسة و نص بكرة الصباح,ممكن تضربو لي تصحوني خمسة و نص بكرة الصباح
103,بفضل غرفة هادية,بفضل غرفة هادية,بفضل غرفة هادية
104,داير مزيل منكير,داير مزيل منكير,داير مزيل منكير
105,داير بطارية,داير بطارية,داير بطارية
106,هل في فرقة لايف ول دي جي,هل في فرقة لايف ولا دي جي,هل في فرقة لايف ولا دي جي
107,هل ممكن اأجّر شوية معدات الغطس,هل ممكن اأجّر شوية معدات الغطس,هل ممكن اأجّر شوية معدات الغطس
108,داير احجز غرفة لي اربعة ليالي من اتنين وعشرين ديسمبر,داير احجز غرفة لي اربعة ليالي من اثنين وعشرين ديسمبر,داير احجز غرفة لي اربعة ليالي من اتنين وعشرين ديسمبر
109,هل الشنطه دي بتناسب اي طقس,هل الشنطة دي بتناسب اي طقس,هل الشنطه دي بتناسب اي طقس
110,داير دونات من فضلك,داير دونات من فضلك,داير دونات من فضلك
111,فوت الرحلة عشرين لي سان فرانسيسكو,فوت الرحلة عشرين لي سان فرانسيسكو,فوت الرحلة عشرين لي سان فرانسيسكو
112,كم للمطار,كم للمطار,كم للمطار
113,داك كويس متين,داك كويس متين,داك كويس متين
114,كم عمر بنتك,كم عمر بنتك,كم عمر بنتك
115,ممكن توريني شوية من الفنادق الرخيصة و النضيفة,ممكن توريني شوية من الفنادق الرخيصة و النضيفة,ممكن توريني شوية من الفنادق الرخيصة و النضيفة
116,ممكن نحجز ليك غرفة مريحة في قصر قديم جنب نادي قولف مشهور,ممكن نحجز ليك غرفة مريحة في قصر قديم جنب نادي قولف مشهور,ممكن نحجز ليك غرفة مريحة في قصر قديم جنب نادي قولف مشهور
117,بزكي دا لأنه مصنوع من مية في المية مكونات طبيعية,بزكي دا لأنه مصنوع من مية في المية مكونات طبيعية,بزكي ده لأنه مصنوع من مية في المية مكونات طبيعية
118,هل القطر بيقف في برايتون,هل القطر بيقف في برايتون,هل القطر بيقف في برايتون
119,ممكن تكلمني وين ممكن القى تكسي,ممكن تكلمني وين ممكن القى تكسي,ممكن تكلمني وين ممكن القى تكسي
120,تزكرتين درجة ثانية من فضلك,تزكرتين درجة ثانية من فضلك,تزكرتين درجة ثانية من فضلك
121,داير ارسل فاكس,داير ارسل فاكس,داير ارسل فاكس
122,داير حديد ترحال,داير حديد ترحال,داير حديد ترحال
123,ممكن اقدم ليك اي حاجة,ممكن اقدم ليك اي حاجة,ممكن اقدم ليك اي حاجة
124,يومي خايف اسأل لكن قصدك شنو,يومي خايف اسأل لكن قصدك شنو,يومي خايف اسأل لكن قصدك شنو
125,اي لكن ما قوي شديد,اي لكن ما قوي شديد,اي لكن ما قوي شديد
126,انا حساس للكدايس,انا حساس للكدايس,انا حساس للكدايس
127,اي مفروض تملك رخصة قيادة و اه انت مفروض يكون عندك رخصة من لجنة التكسي و الليموزين,اي مفروض تملك رخصة قيادة و اه انت مفروض يكون عندك رخصة من لجنة التكسي و الليموزين,اي مفروض تملك رخصة قيادة و اه انت مفروض يكون عندك رخصة من لجنة التكسي و الليموزين
128,واصل يا سيدي,واصل يا سيدي,واصل يا سيدي
129,داير احجز غرفة لليلة,داير احجز غرفة لليلة,داير احجز غرفة لليلة
130,لا استبعد الضرائب و مصاريف الخدمة,لا استبعد الضرائب و مصاريف الخدمة,لا استبعد الضرايب و مصاريف الخدمة
131,داير تمشي معاي تسوق الليلة,داير تمشي معاي تسوق الليلة,داير تمشي معاي تسوق الليلة
132,هاي دا حقيقة فستان جميل,هاي ده حقيقة فستان جميل,هاي ده حقيقة فستان جميل
133,الآن مكالمتك اتقبلت  من فضلك اتفضل,الآن مكالمتك اتقبلت  من فضلك اتفضل,الآن مكالمتك اتقبلت من فضلك اتفضل
134,كم رقم البوابة,كم رقم البوابة,كم رقم البوابة
135,شنو مطابق تزكار هاوايوان,شنو مطابق تزكار هاوايوان,شنو مطابق تزكار هاوايوان
136,ممكن اصل هناك بالنفق,ممكن اصل هناك بالنفق,ممكن اصل هناك بالنفق
137,داير مجفف شعر,داير مجفف شعر,داير مجفف شعر
138,انا جيت من النرويج,انا جيت من النرويج,انا جيت من النرويج
139,من عشرة لي حداشر من فضلك,من عشرة لي حدعشر من فضلك,من عشرة لي حداشر من فضلك
140,بالتأكيد خليني اشوفه انت اتجرحت بالمهرجان بفترض,بالتأكيد خليني اشوفه انت اتجرحت بالمهرجان افترض,بالتأكيد خليني اشوفه انت اتجرحت بالمهرجان بفترض
141,احتياطيا خليني اخد رقم الزول المسؤول,احتياطيا خليني اخد رقم الزول المسؤول,احتياطيا خليني اخد رقم الزول المسؤول
142,هل في طريق سريع,هل في طريق سريع,هل في طريق سريع
143,لي ما جاء الحفلة امبارح,ليه ما جا الحفلة امبارح,لي ما جا الحفلة امبارح
144,كان في حادث مرور,كان في حادث مرور,كان في حادث مرور
145,سوري عندي الرقم الغلط,سوري عندي الرقم الغلط,سوري عندي الرقم الغلط
146,من فضلك دخل ال بي آي ان بتاعك,من فضلك دخل ال بي آي ان بتاعك,من فضلك دخل ال بي آي ان بتاعك
147,م قادر اعدل الصورة,ما قادر اعدل الصورة,ما قادر اعدل الصورة
148,واحد بيرقر جبنة و عصير برتقال من فضلك,واحد بيرقر جبنة و عصير برتقال من فضلك,واحد بيرقر جبنة و عصير برتقال من فضلك
149,دا جوازي,دا جوازي,ده جوازي
150,لي شكرا ليك كتير اه هل ممكن امشي فوق للقمة,ليه شكرا ليك كثير اه هل ممكن امشي فوق للقمة,لي شكرا ليك كتير اه هل ممكن امشي فوق للقمة
151,ممكن اخد الكروية للموسيقى الجمعة الجاية,ممكن اخد الكروية للموسيقى الجمعة الجاية,ممكن اخد الكروية للموسيقى الجمعة الجاية
152,راكب تاني هناك قال ممكن يبدل معاك المقعد,راكب ثاني هناك قال ممكن يبدل معاك المقعد,راكب تاني هناك قال ممكن يبدل معاك المقعد
153,ممكن امدد اقامتي,ممكن امدد اقامتي,ممكن امدد اقامتي
154,بتعرف اي حاجة بتستحق تتشاف قريب من هنا,بتعرف اي حاجة بتستحق تتشاف قريب من هنا,بتعرف اي حاجة بتستحق تتشاف قريب من هنا
155,لا داير اأجر نص طقم من المضارب و جزمة,لا داير اأجر نص طقم من المضارب و جزمة,لا داير اأجر نص طقم من المضارب و جزمة
156,ممكن توريني لم الشنطة الرايحة تتلقى,ممكن توريني لم الشنطة الرايحة تتلقي,ممكن توريني لم الشنطة الرايحة تتلقى
157,شنو اسم الحديقة القومية دي,شنو اسم الحديقة القومية دي,شنو اسم الحديقة القومية دي
158,عندي جرح,عندي جرح,عندي جرح
159,وين مكان جيد للسياحة,وين مكان جيد للسياحة,وين مكان جيد للسياحة
160,ممكن اشيل شوية فواكه,ممكن اشيل شوية فواكه,ممكن اشيل شوية فواكه
161,ممكن اتغدا هسي,ممكن اتغدى هسي,ممكن اتغدا هسي
162,محتاج ابدل الدولارات دي,محتاج ابدل الدولارات دي,محتاج ابدل الدولارات دي
163,بالتأكيد داير كيرلي,بالتأكيد داير كيرلي,بالتأكيد داير كيرلي
164,هو ما تفاح لكن خوخ,هو ما تفاح لكن خوخ,هو ما تفاح لكن خوخ
