,sent,CODA,prep
656,داير احجز طربيزة لاتنين الساعة سبعة من فضلك,داير احجز طربيزة لاثنين الساعة سبعة من فضلك,داير احجز طربيزة لاتنين الساعة سبعة من فضلك
657,داير شوية كريم الليل,داير شوية كريم الليل,داير شوية كريم الليل
658,ممكن تلف دي زي هدية,ممكن تلف دي زي هدية,ممكن تلف دي زي هدية
659,هي تلاتة و ربع,هي ثلاثة و ربع,هي تلاتة و ربع
660,صعب بالنسبة لينا انو نتكلم انجليزي بي طلاقة,صعب بالنسبة لينا انو نتكلم انجليزي بي طلاقة,صعب بالنسبة لينا انو نتكلم انجليزي بي طلاقة
661,هل عندك ديل في نفس التصميم مع كعوب اعلى,هل عندك ديل في نفس التصميم مع كعوب اعلى,هل عندك ديل في نفس التصميم مع كعوب اعلى
662,داير جاكيت لي طفل عمره عشرة سنوات,داير جاكيت لي طفل عمره عشرة سنوات,داير جاكيت لي طفل عمره عشرة سنوات
663,وديني لي طريق آبي من فضلك,وديني لي طريق آبي من فضلك,وديني لي طريق آبي من فضلك
664,شكرا ليك هلوو شكرا للانتظار,شكرا ليك هلوو شكرا للانتظار,شكرا ليك هلوو شكرا للانتظار
665,انا متأكد اني عندي حجز,انا متأكد اني عندي حجز,انا متأكد اني عندي حجز
666,نحن هنا لي يوم,نحن هنا لي يوم,نحن هنا لي يوم
667,عندي صداع خفيف,عندي صداع خفيف,عندي صداع خفيف
668,استمتعت شديد بالوجبة,استمتعت شديد بالوجبة,استمتعت شديد بالوجبة
669,ممكن اشوف العربية,ممكن اشوف العربية,ممكن اشوف العربية
670,ممكن ترسم لي خريطة من فضلك,ممكن ترسم لي خريطة من فضلك,ممكن ترسم لي خريطة من فضلك
671,اوكي سيدي من فضلك خليك فى غرفتك لغاية الدكتور يجي,اوكي سيدي من فضلك خليك فى غرفتك لغاية الدكتور يجي,اوكي سيدي من فضلك خليك فى غرفتك لغاية الدكتور يجي
672,انا اتسرقت في وايماتالو بيتش من فضلك تعال الآن,انا اتسرقت في وايماتالو بيتش من فضلك تعال الآن,انا اتسرقت في وايماتالو بيتش من فضلك تعال الآن
673,رايك شنو في مية دولار,رايك شنو في مية دولار,رايك شنو في مية دولار
674,داير دا معبى,داير ده معبى,داير ده معبى
675,داير اقدم لإعادة توزيع,داير اقدم لإعادة توزيع,داير اقدم لإعادة توزيع
676,الحكومة دعمت ترقية الصناعات,الحكومة دعمت ترقية الصناعات,الحكومة دعمت ترقية الصناعات
677,عمره تعدى الخمسين سنة افترض,عمره تعدى الخمسين سنة افترض,عمره تعدى الخمسين سنة افترض
678,اقل عمر شنو عشان يعمل ده,اقل عمر شنو عشان يعمل ده,اقل عمر شنو عشان يعمل ده
679,عندك اي خرائط بسيطة للمدينة,عندك اي خرائط بسيطة للمدينة,عندك اي خرايط بسيطة للمدينة
680,اذا ممكن افضل انو ما تقلع السن,اذا ممكن افضل انو ما تقلع السن,اذا ممكن افضل انو ما تقلع السن
681,الحساب هو كورة واحدة و ضربتين,الحساب هو كورة واحدة و ضربتين,الحساب هو كورة واحدة و ضربتين
682,ياتو زمن بصل فيه القطر لي سان دييغو من فضلك,ياتو زمن بصل فيه القطر لي سان دييغو من فضلك,ياتو زمن بصل فيه القطر لي سان دييغو من فضلك
683,داير آخد نظرة لي صندوقك,داير آخد نظرة لي صندوقك,داير آخد نظرة لي صندوقك
684,داير شوية شامبو,داير شوية شامبو,داير شوية شامبو
685,انا مقيم في فندق الهيلتون,انا مقيم في فندق الهيلتون,انا مقيم في فندق الهيلتون
686,انا ما حاسي كويس,انا ما حاسي كويس,انا ما حاسي كويس
687,لكن انا عندي موعد عشان اشوفها الساعة اتنين,لكن انا عندي موعد عشان اشوفها الساعة اثنين,لكن انا عندي موعد عشان اشوفها الساعة اتنين
688,هل العربية دي بتمشي لي ادينبيره,هل العربية دي بتمشي الى ادينبيره,هل العربية دي بتمشي لي ادينبيره
689,نعم من فضلك املأ الفورمة دي,نعم من فضلك املأ الفورمة دي,نعم من فضلك املأ الفورمة دي
690,كم السعر الانت بتاجر بيه للوزن الزائد,كم السعر الانت بتاجر بيه للوزن الزايد,كم السعر الانت بتاجر بيه للوزن الزايد
691,اسمي هو كيمودا داير الغى حجزي للجمعة,اسمي هو كيمودا داير الغي حجزي للجمعة,اسمي هو كيمودا داير الغى حجزي للجمعة
692,اوه انا اسف كان هناك مشاكل و نحن بنعالجها ممكن تنتظرحوالي تلاتين دقيقة,اوه انا اسف كان هناك مشاكل و نحن بنعالجها ممكن تنتظرحوالي ثلاثين دقيقة,اوه انا اسف كان هناك مشاكل و نحن بنعالجها ممكن تنتظرحوالي تلاتين دقيقة
693,زمن المغادرة متين, زمن المغادرة متين,زمن المغادرة متين
694,حصلت عليه,حصلت عليه,حصلت عليه
695,هل انت داير تسوي الفاتورة الآن,هل انت داير تسوي الفاتورة الآن,هل انت داير تسوي الفاتورة الآن
696,العربية جات من الجنبة في التقاطع,العربية جات من الجنبة في التقاطع,العربية جات من الجنبة في التقاطع
697,ده صندوق موسيقى,ده صندوق موسيقى,ده صندوق موسيقى
698,وين الضاحية,وين الضاحية,وين الضاحية
699,هل هناك جولة بص في المدينة,هل هناك جولة بص في المدينة,هل هناك جولة بص في المدينة
700,بنبدا في ياتو زمن,بنبدا في ياتو زمن,بنبدا في ياتو زمن
701,كله تمام سيدي في المقاس الوسط ممكن نوفر ليك سمور زئبقي هل كده كله تمام,كله تمام سيدي في المقاس الوسط ممكن نوفر ليك سمور زئبقي هل كده كله تمام,كله تمام سيدي في المقاس الوسط ممكن نوفر ليك سمور زيبقي هل كده كله تمام
702,انت عندك كدمة عضلة,انت عندك كدمة عضلة,انت عندك كدمة عضلة
703,لكن لازم توعدني انك الحتضرب الكورة ما انا  اوكي,لكن لازم توعدني انك الحتضرب الكورة ما انا  اوكي,لكن لازم توعدني انك الحتضرب الكورة ما انا اوكي
704,و كم تاني,و كم ثاني,و كم تاني
705,ممكن استلف شوية كتان,ممكن استلف شوية كتان,ممكن استلف شوية كتان
706,نوع الجلد المصنوعة منه الشنطة دي شنو,نوع الجلد المصنوعة منه الشنطة دي شنو,نوع الجلد المصنوعة منه الشنطة دي شنو
707,ما اعتقد ان السكين دي نضيفة ممكن تجيب لي واحدة تانية,ما اعتقد ان السكين دي نظيفة ممكن تجيب لي واحدة ثانية,ما اعتقد ان السكين دي نضيفة ممكن تجيب لي واحدة تانية
708,اشتريت دا قبل لحظة لكن ممكن تبدل دا بي داك,اشتريت ده قبل لحظة لكن ممكن تبدل ده بي داك,اشتريت ده قبل لحظة لكن ممكن تبدل ده بي داك
709,هل دا الشارع الصحيح لي سنترال استيشن,هل ده الشارع الصحيح لي سنترال استيشن,هل ده الشارع الصحيح لي سنترال استيشن
710,قارب مع دليل من فضلك,قارب مع دليل من فضلك,قارب مع دليل من فضلك
711,داير اطلب لي بدلة غامضة اللون,داير اطلب لي بدلة غامضة اللون,داير اطلب لي بدلة غامضة اللون
712,الشمسية دي تنفع عصاية,الشمسية دي تنفع عصاية,الشمسية دي تنفع عصاية
713,هل مفروض اخلي عفشي كله في غرفة الامانات,هل مفروض اخلي عفشي كله في غرفة الامانات,هل مفروض اخلي عفشي كله في غرفة الامانات
714,من فضلك وريني جوازك,من فضلك وريني جوازك,من فضلك وريني جوازك
715,هل هناك اي مكان بقبل الغسيل في ايام الأحد,هل هناك اي مكان بقبل الغسيل في ايام الأحد,هل هناك اي مكان بقبل الغسيل في ايام الأحد
716,اتنين بيرقر جبنة من فضلك,اثنين بيرقر جبنة من فضلك,اتنين بيرقر جبنة من فضلك
717,لكن البقشيش ما ضروري,لكن البقشيش ما ضروري,لكن البقشيش ما ضروري
718,ممكن تشوف واحد في قاعة كارنيغي,ممكن تشوف واحد في قاعة كارنيغي,ممكن تشوف واحد في قاعة كارنيغي
719,انا ما معتمد,انا ما معتمد,انا ما معتمد
720,ما هي خصوصيات البيت,ما هي خصوصيات البيت,ما هي خصوصيات البيت
721,داير اعمل موعد مع دكتور,داير اعمل موعد مع دكتور,داير اعمل موعد مع دكتور
722,انا بسال اذا في طربيزة فاضية متاحة جنب الشباك لي سبعة الليلة,انا بسال اذا في طربيزة فاضية متاحة جنب الشباك لي سبعة الليلة,انا بسال اذا في طربيزة فاضية متاحة جنب الشباك لي سبعة الليلة
723,ما بتمانع اني اجي مكانك,ما بتمانع اني اجي مكانك,ما بتمانع اني اجي مكانك
724,شكله انو في مجال للتحسين,شكله انو في مجال للتحسين,شكله انو في مجال للتحسين
725,وين التحت الواطة,وين التحت الواطة,وين التحت الواطة
726,عندك مقاس اصغر, عندك مقاس اصغر,عندك مقاس اصغر
727,وين ممكن القى اسبرين,وين ممكن القى اسبرين,وين ممكن القى اسبرين
728,داك زر الروك,داك زر الروك,داك زر الروك
729,من فضلك اديني مرور اسبوع واحد,من فضلك اديني مرور اسبوع واحد,من فضلك اديني مرور اسبوع واحد
730,دي كليتي,دي كليتي,دي كليتي
731,نوع البنزين هناك شنو ممتاز عادي ونقي,نوع البنزين هناك شنو ممتاز عادي ونقي,نوع البنزين هناك شنو ممتاز عادي ونقي
732,دا واحد,ده واحد,ده واحد
733,حيصيبني برد,حيصيبني برد,حيصيبني برد
734,هو انجليس مشوي مع صلصة خاصة فوق صحن رز,هو انجليس مشوي مع صلصة خاصة فوق صحن رز,هو انجليس مشوي مع صلصة خاصة فوق صحن رز
735,"هو قال ""خلينا نحتفل"" و اخدني للبار هو قال ان ماشى يعمل مكالمة هاتفية و غادر و نهائي ما جا راجع و انا علقت مع فاتورة كبيرة","هو قال ""خلينا نحتفل"" و اخدني للبار هو قال انو ماشي يعمل مكالمة هاتفية و غادر و نهائي ما جا راجع و انا علقت مع فاتورة كبيرة","هو قال ""خلينا نحتفل"" و اخدني للبار هو قال ان ماشى يعمل مكالمة هاتفية و غادر و نهايي ما جا راجع و انا علقت مع فاتورة كبيرة"
736,كم سعره للجالون,كم سعره للجالون,كم سعره للجالون
737,عندي جوازي و الكردت كارد في شنطتي,عندي جوازي و الكردت كارد في شنطتي,عندي جوازي و الكردت كارد في شنطتي
738,حجز الساعة سبعة  تحت اسم مانو,حجز الساعة سبعة  تحت اسم مانو,حجز الساعة سبعة تحت اسم مانو
739,ممكن توريني وين القى القنصلية اليابانية,ممكن توريني وين القى القنصلية اليابانية,ممكن توريني وين القى القنصلية اليابانية
740,هل هناك طبيب الفندق او واحد في الاتصال,هل هناك طبيب الفندق او واحد في الاتصال,هل هناك طبيب الفندق او واحد في الاتصال
741,هو دائما بتسوق في شارع بوند,هو دايما بتسوق في شارع بوند,هو دايما بتسوق في شارع بوند
742,ورقة انجليزي من فضلك,ورقة انجليزي من فضلك,ورقة انجليزي من فضلك
743,هل هناك اي محل بشغل موسيقى ريفية,هل هناك اي محل بشغل موسيقى ريفية,هل هناك اي محل بشغل موسيقى ريفية
744,داير اراجع حاجاتي القيمة,داير اراجع حاجاتي القيمة,داير اراجع حاجاتي القيمة
745,اي واحدات صوفية تانية,اي واحدات صوفية ثانية,اي واحدات صوفية تانية
746,كم السعر بي الشيت,كم السعر بي الشيت,كم السعر بي الشيت
747,طيب اضغط تسعة و صفر واحد واحد بعده مفتاح الدولة و رقم الهاتف,طيب اضغط تسعة و صفر واحد واحد بعده مفتاح الدولة و رقم الهاتف,طيب اضغط تسعة و صفر واحد واحد بعده مفتاح الدولة و رقم الهاتف
748,ممكن احصل على دايت كوكا,ممكن احصل على دايت كوكا,ممكن احصل على دايت كوكا
749,ممكن اطلب,ممكن اطلب,ممكن اطلب
750,عندنا قيادة جميلة شكرا ليك,عندنا قيادة جميلة شكرا ليك,عندنا قيادة جميلة شكرا ليك
751,اعذرني ممكن تسمح لي اعبر,اعذرني ممكن تسمح لي اعبر,اعذرني ممكن تسمح لي اعبر
752,داير اأجر شمسية,داير اأجر شمسية,داير اأجر شمسية
753,نعم و انا داير اراجع الرسوم,نعم و انا داير اراجع الرسوم,نعم و انا داير اراجع الرسوم
754,محفظة بمية دولار و اتنين كردت كارد,محفظة بمية دولار و اثنين كردت كارد,محفظة بمية دولار و اتنين كردت كارد
755,موية ساخنة شديد,موية ساخنة شديد,موية ساخنة شديد
756,انت هنا,انت هنا,انت هنا
757,قدر قهوة من فضلك,قدر قهوة من فضلك,قدر قهوة من فضلك
758,غير مرجح بشكل عالي,غير مرجح بشكل عالي,غير مرجح بشكل عالي
759,بطني بتوجع بعد الوجبات,بطني بتوجع بعد الوجبات,بطني بتوجع بعد الوجبات
760,وااااو داك مكان جميل,وااااو داك مكان جميل,وااااو داك مكان جميل
761,هو احتمال يكون عنده جلطة,هو احتمال يكون عنده جلطة,هو احتمال يكون عنده جلطة
762,انت قررت,انت قررت,انت قررت
763,انا ضيعت اثر بريد مسجل,انا ضيعت اثر بريد مسجل,انا ضيعت اثر بريد مسجل
764,ما بتقدر تغير شغلك بسهولة,ما بتقدر تغير شغلك بسهولة,ما بتقدر تغير شغلك بسهولة
765,المحطة الجاية شنو,المحطة الجاية شنو,المحطة الجاية شنو
766,كله تمام لكن ما المدرجات  هي حارة شديد الليلة,كله تمام لكن ما المدرجات  هي حارة شديد الليلة,كله تمام لكن ما المدرجات هي حارة شديد الليلة
767,مفروض احصل رحلة عشرة صباحا,مفروض احصل رحلة عشرة صباحا,مفروض احصل رحلة عشرة صباحا
768,انا لسة حاسي بنفسي بستفرغ,انا لسا حاسي بنفسي بستفرغ,انا لسة حاسي بنفسي بستفرغ
769,ما داير اي شي كبير,ما داير اي شي كبير,ما داير اي شي كبير
770,راجع من فضلك,راجع من فضلك,راجع من فضلك
771,كم سعر فطر طازج,كم سعر فطر طازج,كم سعر فطر طازج
772,اشحن من فضلك بتاخد فيزا,اشحن من فضلك بتاخد فيزا,اشحن من فضلك بتاخد فيزا
773,اتنين صفر اتنين تسعة تلاتة تسعة ستة سبعة صفر صفر,اثنين صفر اثنين تسعة ثلاثة تسعة ستة سبعة صفر صفر,اتنين صفر اتنين تسعة تلاتة تسعة ستة سبعة صفر صفر
774,داير سني تتقلع,داير سني تتقلع,داير سني تتقلع
775,داير شنطة كريمات,داير شنطة كريمات,داير شنطة كريمات
776,انا بسال كم من البقشيش مفروض اخلي,انا بسال كم من البقشيش مفروض اخلي,انا بسال كم من البقشيش مفروض اخلي
777,"وين ممكن اشوف""الخيال بتاع اوبرا""","وين ممكن اشوف""الخيال بتاع اوبرا""","وين ممكن اشوف""الخيال بتاع اوبرا"""
778,ما متوسط رسوم الفاكس العالمي شهريا,ما متوسط رسوم الفاكس العالمي شهريا,ما متوسط رسوم الفاكس العالمي شهريا
779,مقلي بالجنبتين من فضلك,مقلي بالجنبتين من فضلك,مقلي بالجنبتين من فضلك
780,اوكي دا شكله واضح جدا  انتو الاتنين من فضلكم ادوني رخصكم و تسجيلاتكم  و يا ولد آسف لازم نعمل ليك اختبار تحليل تنفس,اوكي دا شكله واضح جدا  انتم الاتنين من فضلكم ادوني رخصكم و تسجيلاتكم  و يا ولد آسف لازم نعمل ليك اختبار تحليل تنفس,اوكي ده شكله واضح جدا انتو الاتنين من فضلكم ادوني رخصكم و تسجيلاتكم و يا ولد آسف لازم نعمل ليك اختبار تحليل تنفس
781,هل دا معمول من القطن,هل ده معمول من القطن,هل ده معمول من القطن
782,عندي دواي الخاص,عندي دواي الخاص,عندي دواي الخاص
783,ممكن اشوف شنو في الرحلة دي,ممكن اشوف شنو في الرحلة دي,ممكن اشوف شنو في الرحلة دي
784,نعم هناك في مشروب واحد على الأقل,نعم هناك في مشروب واحد على الأقل,نعم هناك في مشروب واحد على الأقل
785,كم سعره في اليوم,كم سعره في اليوم,كم سعره في اليوم
786,هل البص بقيف جنب الفندق,هل البص بقيف جنب الفندق,هل البص بقيف جنب الفندق
787,داير سي دي,داير سي دي,داير سي دي
788,في رحلات الخطوط الجوية اليابانية وأول نيبون البغادروا عشرة و خمسة وخمسين لكن لسوء الحظ الرحلتين ملانات,في رحلات الخطوط الجوية اليابانية وأول نيبون البغادروا عشرة و خمسة وخمسين لكن لسوء الحظ الرحلتين ملانات,في رحلات الخطوط الجوية اليابانية وأول نيبون البغادروا عشرة و خمسة وخمسين لكن لسو الحظ الرحلتين ملانات
789,هو بناسبني تمام,هو بناسبني تمام,هو بناسبني تمام
790,ممكن طربيزة لي خمسة,ممكن طربيزة لي خمسة,ممكن طربيزة لي خمسة
791,هي ما بتفهم انجليزي نهائي,هي ما بتفهم انجليزي نهائي,هي ما بتفهم انجليزي نهايي
792,من فضلك اصرف شيك السفر,من فضلك اصرف شيك مسافر,من فضلك اصرف شيك السفر
793,ممكن تهتم بيها من تسعة صباحا لي ثلاثة كده,ممكن تهتم بيها من تسعة صباحا لي ثلاثة كده,ممكن تهتم بيها من تسعة صباحا لي ثلاثة كده
794,كم سعر البريد الجوي لليابان,كم سعر البريد الجوي لليابان,كم سعر البريد الجوي لليابان
795,انا اتقفلت ممكن تفتح بابي من فضلك,انا اتقفلت ممكن تفتح بابي من فضلك,انا اتقفلت ممكن تفتح بابي من فضلك
796,ياتو جولة احسن عشن تشوف احسن الأماكن المعروفة,ياتو جولة احسن عشن تشوف احسن الأماكن المعروفة,ياتو جولة احسن عشن تشوف احسن الأماكن المعروفة
797,هل في اي مضيفه بتتكلم ياباني,هل في اي مضيفة بتتكلم ياباني,هل في اي مضيفه بتتكلم ياباني
798,كم شنطة ممكن اجيبها في الطيارة,كم شنطة ممكن اجيبها في الطيارة,كم شنطة ممكن اجيبها في الطيارة
799,لا يا سيدي بعد الظهر محجوز كله  لكن بكرة اوكي,لا يا سيدي بعد الظهر محجوز كله  لكن بكرة اوكي,لا يا سيدي بعد الظهر محجوز كله لكن بكرة اوكي
800,انا حاسأل البواب عن الأجرة الصاح,انا حاسأل البواب عن الأجرة الصاح,انا حاسأل البواب عن الأجرة الصاح
801,انا حقيقة آسف,انا حقيقة آسف,انا حقيقة آسف
802,عندنا حفلة ليلة الجمعة لي ماتنضم لينا,عندنا حفلة ليلة الجمعة لي ماتنضم لينا,عندنا حفلة ليلة الجمعة لي ماتنضم لينا
803,طيب غرفتك تسعة صفر تمنية يا انسة دا مفتاحك,طيب غرفتك تسعة صفر ثمانية يا انسة ده مفتاحك,طيب غرفتك تسعة صفر تمنية يا انسة ده مفتاحك
804,انه مهم جدا ان عندنا وصول للمواد الخام البنحتاج ليها للمشروع,انه مهم جدا ان عندنا وصول للمواد الخام البنحتاج ليها للمشروع,انه مهم جدا ان عندنا وصول للمواد الخام البنحتاج ليها للمشروع
805,اعذرني ضابط,اعذرني ضابط,اعذرني ضابط
806,هل القطر ده بمشي مباشرة لي ادينبره,هل القطر ده بمشي مباشرة لي ادينبره,هل القطر ده بمشي مباشرة لي ادينبره
807,هل دا ف الحد بتاع اعفاء الضرائب,هل ده في الحد بتاع اعفاء الضرائب,هل ده فالحد بتاع اعفا الضرايب
808,شيل حاجاتي القيمة من فضلك,شيل حاجاتي القيمة من فضلك,شيل حاجاتي القيمة من فضلك
809,كيف الرحلات السياحية مزحومة,كيف الرحلات السياحية مزحومة,كيف الرحلات السياحية مزحومة
810,داير اشتري شوية تذكارات هل هناك اي متجر مناسب قريب هنا,داير اشتري شوية تذكارات هل هناك اي متجر مناسب قريب هنا,داير اشتري شوية تذكارات هل هناك اي متجر مناسب قريب هنا
811,لغاية متين بفتح,لغاية متين بفتح,لغاية متين بفتح
812,هو طالع اسى,هو طالع اسي,هو طالع اسى
813,مايومي ممكن تملى الورقة دي بتوقيعك,مايومي ممكن تملي الورقة دي بتوقيعك,مايومي ممكن تملى الورقة دي بتوقيعك
814,هنا واحد ليك سيدي,هنا واحد ليك سيدي,هنا واحد ليك سيدي
815,ما عندي عفش للتسجيل,ما عندي عفش للتسجيل,ما عندي عفش للتسجيل
816,اكيد اخد زمنك,اكيد اخد زمنك,اكيد اخد زمنك
817,انا هنا في مهمة وسائط الإعلام,انا هنا في مهمة وسائط الإعلام,انا هنا في مهمة وسايط الإعلام
